question_id	scenario_id	type	category	question_text	image_url	option_A	option_B	option_C	option_D	correct_option	explanation	tags	
Q_01	CASE_01	MCQ	Oral Pathology	Based on the clinical triad of symptoms presented in the patient's history and exam, what is the most likely diagnosis?		Angioedema	Melkersson-Rosenthal Syndrome	Cheilitis Glandularis	Crohn's Disease	Option_B	Why: Melkersson-Rosenthal Syndrome is defined by a classic triad: fissured tongue, granulomatous cheilitis (lip swelling), and facial paralysis (Bell's palsy). This patient presents with all three components (history of paralysis, current lip swelling, fissured tongue).  Why not: Angioedema is usually allergic/acute. Cheilitis Glandularis involves salivary glands. Crohn's can cause lip swelling (orofacial granulomatosis) but the specific triad strongly favors Melkersson-Rosenthal.	Melkersson-Rosenthal, Syndrome, Triad	
Q_02	CASE_01	MCQ	Oral Pathology	The tongue condition observed in this patient is most commonly associated with which of the following descriptions?		Geographic Tongue	Median Rhomboid Glossitis	Fissured Tongue	Hairy Tongue	Option_C	Why: The clinical notes describe "deep grooves and furrows," which is characteristic of Fissured Tongue (also called Scrotal Tongue). This is a component of Melkersson-Rosenthal Syndrome.  Why not: Geographic tongue involves migrating red/white patches. Median rhomboid is a fungal infection. Hairy tongue involves filiform papillae elongation.	Fissured Tongue, Tongue, Anatomy	
Q_03	CASE_01	MCQ	Oral Pathology	If a biopsy of the swollen lip were performed, what histological finding would be expected?		Malignant squamous cells	Non-caseating granulomatous inflammation	Cystic cavity lined by epithelium	Ectopic sebaceous glands	Option_B	Why: The lip swelling in Melkersson-Rosenthal Syndrome is technically "Granulomatous Cheilitis," characterized histologically by non-caseating granulomas.  Why not: Ectopic sebaceous glands are Fordyce Granules. Cystic cavities are true cysts. Malignancy is not indicated by this benign syndrome.	Histology, Granulomatous Cheilitis	
Q_04		RAPID_FIRE	Oral Pathology	Leukoedema is a white, edematous lesion on the buccal mucosa that characteristically disappears when the cheek is stretched.		TRUE	FALSE			Option_A	Why: True. This is the classic diagnostic test for Leukoedema. It helps differentiate it from other white lesions like Leukoplakia or Lichen Planus, which do not disappear upon stretching.  Why not: N/A	Leukoedema, Diagnosis	
Q_05		RAPID_FIRE	Oral Pathology	A Stafne Bone Defect is a true cyst located in the posterior mandible above the mandibular canal.		TRUE	FALSE			Option_B	Why: False. A Stafne Bone Defect is a pseudocyst (no epithelial lining) and is classically located below the mandibular canal. It is caused by a lingual concavity of the jaw containing salivary gland tissue.  Why not: N/A	Stafne Bone Defect, Radiography	
Q_06		RAPID_FIRE	Oral Pathology	Traumatic Bone Cysts (Simple Bone Cysts) are distinguished from true cysts by their lack of an epithelial lining.		TRUE	FALSE			Option_A	Why: True. Traumatic Bone Cysts are pseudocysts. They appear as scalloped radiolucencies around roots but do not have the epithelial lining required to be classified as a true cyst.  Why not: N/A	Traumatic Bone Cyst, Pseudocyst	
Q_07	CASE_02	MCQ	Oral Pathology	Based on the location and clinical presentation, what is the most likely diagnosis for this patient?		Branchial Cyst	Thyroglossal Duct Cyst	Stafne Bone Defect	Dermoid Cyst	Option_B	Why: Thyroglossal Duct Cysts present as a midline neck swelling located along the embryonic path of thyroid descent.   Why not: Branchial cysts present as a lateral neck swelling. Stafne defects are in the mandible (bone). Dermoid cysts can be midline but are typically "doughy" and found in the floor of the mouth (above mylohyoid) or upper neck, but the connection to swallowing/tongue movement is classic for Thyroglossal.	Thyroglossal Duct Cyst, Neck Swelling, Differential Diagnosis	
Q_08	CASE_02	MCQ	Embryology	If this lesion is a Thyroglossal Duct Cyst, it represents a failure of complete descent of thyroid tissue originating from which anatomical landmark?		Foramen Ovale	Foramen Cecum	Branchial Arches	Rathke's Pouch	Option_B	Why: The thyroid gland begins development at the foramen cecum (midline base of the tongue) and descends into the neck. A cyst forms if remnants remain along this path.  Why not: Branchial arches are lateral. Rathke's pouch is pituitary. Foramen ovale is a cranial nerve exit.	Embryology, Thyroid, Foramen Cecum	
Q_09	CASE_02	MCQ	Oral Pathology	Which of the following conditions presents as a lateral neck swelling and is considered an epithelial cyst within a lymph node?		Thyroglossal Duct Cyst	Branchial Cyst	Lingual Thyroid	Nasopalatine Duct Cyst	Option_B	Why: The transcript explicitly contrasts Branchial Cysts with Thyroglossal Cysts, noting that Branchial Cysts are lateral neck swellings (related to branchial arches) and are cysts within a lymph node.  Why not: Thyroglossal and Lingual Thyroid are midline. Nasopalatine is in the maxilla.	Branchial Cyst, Lymph Node, Lateral Neck	
Q_10		RAPID_FIRE	Oral Pathology	Fordyce Granules are ectopic sebaceous glands found on the buccal mucosa that require immediate biopsy.		TRUE	FALSE			Option_B	Why: False. While they are ectopic sebaceous glands, the transcript states they are "completely benign, no treatment necessary." They are a variation of normal.  Why not: N/A	Fordyce Granules, Benign, Treatment	
Q_11		RAPID_FIRE	Oral Pathology	A "Globulomaxillary Lesion" is a specific diagnosis for a pear-shaped radiolucency between the maxillary lateral incisor and canine.		TRUE	FALSE			Option_B	Why: False. The transcript emphasizes that "Globulomaxillary lesion" is a clinical description of a location/radiolucency, not a diagnosis itself. It describes any radiolucency in that specific area.  Why not: N/A	Globulomaxillary, Terminology, Diagnosis	
Q_12		RAPID_FIRE	Oral Pathology	Sturge-Weber Syndrome involves angiomas of the leptomeninges and skin along the distribution of the trigeminal nerve.		TRUE	FALSE			Option_A	Why: True. The transcript defines Sturge-Weber by angiomas of the leptomeninges (pia/arachnoid) and the skin (Port Wine Stain) along V1, V2, or V3.  Why not: N/A	Sturge-Weber Syndrome, Angioma, Neurology	
Q_13	CASE_03	MCQ	Oral Pathology	Based on the patient's history and clinical presentation, what is the most likely diagnosis for the brown gingival macules?		Melanotic Macule	Smoker's Melanosis	Amalgam Tattoo	Peutz-Jeghers Syndrome	Option_B	Why: Smoker's Melanosis presents as brown, diffuse, irregular macules typically on the anterior gingiva. It is caused by tobacco chemicals stimulating melanocytes to deposit melanin. The patient's 30-year smoking history strongly supports this.  Why not: Melanotic macules are usually solitary (like a freckle). Amalgam tattoos are blue/grey and focal (usually near restorations). Peutz-Jeghers would involve perioral freckling and intestinal polyps.	Smoker's Melanosis, Smoking, Pigmentation	
Q_14	CASE_03	MCQ	Oral Pathology	The "red dots" observed on the patient's palate in Nicotine Stomatitis represent which of the following?		Inflamed minor salivary duct openings	Petechiae caused by suction	Dysplastic erythroplakia	Candidiasis infection	Option_A	Why: Nicotine Stomatitis is characterized by a white, hyperkeratotic palate with red dots. These red dots are specifically inflamed openings of the minor salivary glands/ducts in response to heat.  Why not: Petechiae are hemorrhages. Erythroplakia is a premalignant red patch. Candidiasis wipes off.	Nicotine Stomatitis, Salivary Glands, Palate	
Q_15	CASE_03	MCQ	Pharmacology	If this patient also presented with "sloughing" of the buccal mucosa that peels off easily, which ingredient in their toothpaste should likely be avoided?		Sodium Fluoride	Triclosan	Sodium Lauryl Sulfate (SLS)	Potassium Nitrate	Option_C	Why: Sodium Lauryl Sulfate (SLS) is a surfactant associated with "Dentifrice-associated sloughing." Switching to an SLS-free toothpaste (e.g., Rembrandt, Tom's of Maine) often resolves the issue.  Why not: The other ingredients are active agents (cavity prevention, sensitivity) not typically associated with mucosal sloughing.	Sodium Lauryl Sulfate, Dentifrice, Sloughing	
Q_16		RAPID_FIRE	Oral Pathology	Peutz-Jeghers Syndrome is characterized by the triad of perioral freckles (melanotic macules), intestinal polyps, and predisposition to intestinal obstruction/cancer.		TRUE	FALSE			Option_A	Why: True. The mnemonic "PJs" (someone home sick in PJs) helps recall the intestinal distress (polyps) and spots (freckles) associated with this syndrome.  Why not: N/A	Peutz-Jeghers Syndrome, Syndrome, Genetics	
Q_17		RAPID_FIRE	Oral Pathology	An amalgam tattoo is a vascular lesion that will blanch upon diascopy (pressure test).		TRUE	FALSE			Option_B	Why: False. Amalgam tattoos are extravascular exogenous pigmentation (metal particles in tissue). They do not blanch. Vascular lesions like hemangiomas blanch (unless thrombosed).  Why not: N/A	Amalgam Tattoo, Diagnosis, Blanching	
Q_18		RAPID_FIRE	Oral Pathology	Hairy Tongue is caused by the elongation of fungiform papillae.		TRUE	FALSE			Option_B	Why: False. Hairy Tongue is caused by the elongation of filiform papillae (the hair-like ones), not fungiform (the mushroom-shaped ones).  Why not: N/A	Hairy Tongue, Anatomy, Papillae	
Q_19	CASE_04	MCQ	Oral Pathology	Based on the clinical presentation and history of placing a pill on the gum, what is the diagnosis?		Candidiasis (Thrush)	Aspirin Burn (Chemical Burn)	Linea Alba	Lichen Planus	Option_B	Why: Placing an aspirin tablet directly on the mucosa causes a chemical burn (coagulative necrosis). The key clinical feature is the "whitish sloughing" appearance where the epithelium peels away.  Why not: Candidiasis can wipe off but isn't caused by a pill. Linea Alba is a frictional line. Lichen Planus is an autoimmune condition (Wickham striae).	Aspirin Burn, Chemical Injury, Diagnosis	
Q_20	CASE_04	MCQ	Oral Pathology	Which of the following substances can cause a similar chemical burn to the one seen in this patient?		Sodium Lauryl Sulfate	Silver Nitrate	Hydrogen Peroxide	Phenol	Option_D	Why: The video lists Phenol, Silver Nitrate, and Hydrogen Peroxide as other agents that cause chemical burns similar to aspirin.  Note: While all options are listed in the video as chemical irritants, Phenol is a classic cauterizing agent often tested as a cause of iatrogenic burns. (Any of B, C, or D could technically be correct based on the list, but Phenol is a strong distractor). Correction based on strict video list: The video explicitly lists "Aspirin, Hydrogen Peroxide, Silver Nitrate, and Phenol" as causes. I will select Phenol as the correct option for this specific question structure.	Chemical Burn, Etiology, Phenol	
Q_21	CASE_04	MCQ	Oral Pathology	The clinical notes describe the lesion as an "ulcer" after the white tissue sloughs. How does an ulcer differ from an erosion?		Ulcers are painless; erosions are painful.	Ulcers extend into the submucosa; erosions are limited to the mucosal epithelium.	Ulcers are viral; erosions are bacterial.	Ulcers blanch; erosions do not.	Option_B	Why: The transcript defines an erosion as an "incomplete break" (mucosal layer only), while an ulcer is a "complete break" extending through the epithelium into the submucosa.  Why not: Both can be painful (ulcers typically more so). Etiology varies for both.	Ulcer, Erosion, Definitions	
Q_22		RAPID_FIRE	Oral Pathology	Linea Alba is a form of focal hyperkeratosis caused by chronic friction at the level of the occlusal plane.		TRUE	FALSE			Option_A	Why: True. It literally translates to "white line" and acts like a callus (hyperkeratosis) where the teeth meet against the cheek.  Why not: N/A	Linea Alba, Hyperkeratosis, Friction	
Q_23		RAPID_FIRE	Oral Pathology	A hematoma is a submucosal hemorrhage that is smaller than a petechia.		TRUE	FALSE			Option_B	Why: False. The video ranks hemorrhages by size: Petechiae (1mm) < Purpura < Ecchymosis (>1cm) < Hematoma (large mass of blood). Hematomas are the largest.   Why not: N/A	Hematoma, Hemorrhage, Definitions	
Q_24		RAPID_FIRE	Oral Pathology	Submucosal hemorrhages (like petechiae and ecchymosis) will blanch when pressure is applied (diascopy test).		TRUE	FALSE			Option_B	Why: False. The video emphasizes that "extravascular lesions do not blanch." Blood has escaped the vessels (like a broken water balloon), so pressure cannot move it away. Vascular lesions (like hemangiomas) do blanch.  Why not: N/A	Blanching, Diascopy, Hemorrhage	
Q_25	CASE_05	MCQ	Oral Pathology	The clinical presentation of facial paralysis, vertigo, and deafness is characteristic of which syndrome?		Melkersson-Rosenthal Syndrome	Ramsay Hunt Syndrome	Behcet's Syndrome	Stevens-Johnson Syndrome	Option_B	Why: Ramsay Hunt Syndrome is caused by the reactivation of Herpes Zoster in the geniculate ganglion. It affects cranial nerves VII (facial paralysis) and VIII (vertigo, deafness).  Why not: Melkersson-Rosenthal involves fissured tongue/lip swelling. Behcet's involves aphthous ulcers/uveitis. SJS is a severe drug reaction.	Ramsay Hunt Syndrome, Herpes Zoster, Cranial Nerves	
Q_26	CASE_05	MCQ	Microbiology	The underlying pathogen responsible for the syndrome described in this case is the same virus that causes:		Chickenpox (Varicella)	Hand-Foot-and-Mouth Disease	Herpangina	Oral Hairy Leukoplakia	Option_A	Why: The virus is Varicella-Zoster Virus (VZV). The primary infection is Chickenpox (Varicella), and the recurrent infection is Shingles (Zoster). Ramsay Hunt is a manifestation of Zoster.  Why not: Hand-Foot-and-Mouth and Herpangina are caused by Coxsackie virus. Oral Hairy Leukoplakia is caused by Epstein-Barr Virus (EBV).	Varicella-Zoster, Virus, Etiology	
Q_27	CASE_05	MCQ	Oral Pathology	If this patient had presented with "Oral Hairy Leukoplakia" instead, which viral pathogen would be the causative agent?		Human Papilloma Virus (HPV)	Herpes Simplex Virus (HSV)	Epstein-Barr Virus (EBV)	Coxsackie Virus	Option_C	Why: Oral Hairy Leukoplakia (white patch on lateral tongue that doesn't wipe off) is caused by the Epstein-Barr Virus (EBV) and is an opportunistic infection often associated with HIV.  Why not: HPV causes papillomas/warts. HSV causes herpes labialis/stomatitis. Coxsackie causes herpangina.	Epstein-Barr Virus, Oral Hairy Leukoplakia, HIV	
Q_28		RAPID_FIRE	Oral Pathology	Recurrent Intraoral Herpes occurs exclusively on keratinized tissue (attached gingiva and hard palate).		TRUE	FALSE			Option_A	Why: True. This is a key distinction. Primary herpes is pan-oral, but recurrent intraoral herpes is limited to keratinized tissues (bound down tissue). Recurrent aphthous ulcers occur on loose, non-keratinized tissue.  Why not: N/A	Herpes Simplex, Recurrent, Keratinized Mucosa	
Q_29		RAPID_FIRE	Oral Pathology	Actinomycosis is a fungal infection characterized by sulfur granules in the purulent exudate.		TRUE	FALSE			Option_B	Why: False. Actinomycosis is a bacterial infection (Actinomyces israelii), despite the misleading name ending in "-mycosis." It does, however, present with sulfur granules.  Why not: N/A	Actinomycosis, Bacteria, Sulfur Granules	
Q_30		RAPID_FIRE	Oral Pathology	Strawberry Tongue, seen in Scarlet Fever, is caused by the inflammation of filiform papillae.		TRUE	FALSE			Option_B	Why: False. Strawberry Tongue is caused by the inflammation of fungiform papillae (red dots on white tongue). Hairy tongue involves the filiform papillae.  Why not: N/A	Scarlet Fever, Strawberry Tongue, Papillae	
Q_31	CASE_06	MCQ	Oral Pathology	Based on the clinical presentation of mucous patches and palmar/plantar rash, which stage of Syphilis is this patient exhibiting?		Primary Syphilis	Secondary Syphilis	Tertiary Syphilis	Congenital Syphilis	Option_B	Why: Secondary Syphilis is characterized by oral mucous patches, condyloma latum, and a maculopapular rash. Primary syphilis presents with a chancre. Tertiary presents with Gummas.   Why not: The chancre (primary) heals before secondary symptoms appear. Gummas are late-stage destructive lesions.	Syphilis, Infectious Disease, Stages	
Q_32	CASE_06	MCQ	Microbiology	What is the causative organism for the infection described in this case?		Neisseria gonorrhoeae	Mycobacterium tuberculosis	Treponema pallidum	Actinomyces israelii	Option_C	Why: Syphilis is caused by the spirochete Treponema pallidum.  Why not: Neisseria causes Gonorrhea. Mycobacterium causes TB. Actinomyces causes Actinomycosis.	Treponema pallidum, Microbiology, Syphilis	
Q_33	CASE_06	MCQ	Oral Pathology	If this infection were transmitted congenitally, which of the following is part of "Hutchinson's Triad"?		Cleft Palate	Mulberry Molars	Geographic Tongue	Turner's Tooth	Option_B	Why: Hutchinson's Triad for Congenital Syphilis consists of: 1) Hutchinson's Incisors (notched) & Mulberry Molars, 2) Ocular Interstitial Keratitis, and 3) CN VIII Deafness.  Why not: Turner's tooth is caused by local trauma/infection to a primary tooth. Cleft palate is developmental.	Hutchinson's Triad, Congenital Syphilis, Dental Anomalies	
Q_34		RAPID_FIRE	Oral Pathology	Koplik's Spots are small white spots on the buccal mucosa that precede the skin rash in Measles (Rubeola).		TRUE	FALSE			Option_A	Why: True. Koplik's spots are pathognomonic for Measles (Rubeola) and are often described as "inflamed Stensen's duct openings" or salt grains on a red background.  Why not: N/A	Measles, Koplik's Spots, Rubeola	
Q_35		RAPID_FIRE	Oral Pathology	Condyloma Acuminatum is a genital wart caused by HPV strains 6 and 11 that can also present orally.		TRUE	FALSE			Option_A	Why: True. Condyloma Acuminatum is caused by low-risk HPV types 6 and 11. It presents as a cauliflower-like lesion.  Why not: N/A	HPV, Condyloma Acuminatum, Virology	
Q_36		RAPID_FIRE	Oral Pathology	Herpangina is caused by the Coxsackie virus and typically presents with ulcers on the anterior gingiva and hard palate.		TRUE	FALSE			Option_B	Why: False. Herpangina (Coxsackie virus) presents with vesicles/ulcers in the posterior oral cavity (soft palate, throat, tonsils). Herpes Simplex affects the anterior/keratinized tissue.  Why not: N/A	Herpangina, Coxsackie Virus, Differential Diagnosis	
question_id	scenario_id	type	category	question_text		option_A	option_B	option_C	option_D	correct_option	explanation	tags	
Q_37	CASE_07	CASE	Pharmacology	The dentist administers 2% Lidocaine w/ 1:100,000 epinephrine. What is the maximum recommended dose (MRD) in mg for this 22 kg patient (using the conservative 4.4 mg/kg rule)?		88 mg	96.8 mg	120 mg	300 mg	B	Why: Calculation: 22 kg multiplied by 4.4 mg/kg equals 96.8 mg. The weight-based limit applies before the absolute maximum of 300 mg. Why not: 88 mg is too low. 120 mg exceeds the weight limit. 300 mg is the absolute adult maximum.	Calculation,Pediatric,Lidocaine	
Q_38	CASE_07	CASE	Pharmacology	Approximately how many cartridges of 2% Lidocaine (1.8 mL) can be safely administered to this patient?		1.5 cartridges	2.7 cartridges	3.5 cartridges	4.4 cartridges	B	Why: 2% Lidocaine contains 36 mg per 1.8mL cartridge. 96.8 mg (MRD) divided by 36 mg/cartridge equals approx 2.68 cartridges. Round down to 2.6 or 2.7 for safety. Why not: 1.5 is too conservative. 3.5 exceeds the limit (3.5 * 36 = 126 mg).	Calculation,Dosage	
Q_39	CASE_07	CASE	Pharmacology	Post-injection the patient exhibits confusion, tremors, and shivering. These are clinical signs of which phase of local anesthetic toxicity?		Allergic reaction	Initial CNS excitation	CNS depression phase	Cardiovascular collapse	B	Why: LA toxicity is biphasic. Phase 1 is CNS Excitation (tremors, talkativeness, agitation). Why not: Phase 2 is CNS Depression (seizures, respiratory arrest). Allergic reactions usually present with cutaneous or respiratory signs.	Toxicity,Symptoms	
Q_40	CASE_08	CASE	Pharmacology	Does this patient require antibiotic prophylaxis for her Total Hip Replacement according to current ADA/AAOS guidelines?		Yes for life	Yes for the first 2 years only	No unless she has a history of prosthetic joint infection	Yes because she has diabetes	C	Why: Current guidelines generally do NOT recommend prophylactic antibiotics for prosthetic joint implants unless there is a specific history of complications or infection with the joint. Why not: "For life" and "first 2 years" are outdated guidelines. Diabetes is a risk factor but does not mandate prophylaxis alone.	Guidelines,Prophylaxis	
Q_41	CASE_08	CASE	Pharmacology	Given the acute abscess and systemic risk factors the dentist prescribes an antibiotic. Considering her Penicillin allergy (hives), which is the most appropriate first-line choice?		Amoxicillin 500mg	Cephalexin 500mg	Clindamycin 300mg	Azithromycin 500mg	B	Why: For a non-anaphylactic penicillin allergy (hives/rash), a first-generation cephalosporin like Cephalexin is often the preferred alternative due to efficacy and low cross-reactivity. Why not: Clindamycin is no longer first-line due to C. diff risks. Amoxicillin is contraindicated due to allergy.	Antibiotics,Allergy	
Q_42	CASE_08	CASE	Pharmacology	If the patient had a history of Type I hypersensitivity (Anaphylaxis) to Penicillin, which antibiotic would be the safest choice?		Cephalexin	Ampicillin	Azithromycin	Augmentin	C	Why: In cases of anaphylaxis, all beta-lactams (including cephalosporins) should be avoided due to potential cross-reactivity. Macrolides like Azithromycin are indicated. Why not: Cephalexin, Ampicillin, and Augmentin are beta-lactams.	Allergy,Anaphylaxis	
Q_43	CASE_09	CASE	Pharmacology	The "electric shock" sensation described by the patient during the block indicates the needle likely contacted which structure?		Lingual Nerve	Inferior Alveolar Nerve sheath	Mylohyoid Nerve	Long Buccal Nerve	B	Why: A sudden "shock" sensation implies direct physical contact with the nerve trunk or sheath. In an IANB, this is most often the IAN or the Lingual nerve. Why not: It does not indicate the Mylohyoid or Long Buccal nerves, which are anatomically distinct from the injection site.	Complications,Technique	
Q_44	CASE_09	CASE	Pharmacology	To maximize success of the IANB, the needle target is the area superior to the mandibular foramen, bordering which bony landmark laterally?		Pterygomandibular raphe	Internal oblique ridge	Lingula	Coronoid notch	C	Why: The Lingula is the small bony projection covering the mandibular foramen. The solution is deposited just superior to it. Why not: Pterygomandibular raphe is soft tissue. Coronoid notch is used to determine height but is not the target itself.	Anatomy,Landmarks	
Q_45	CASE_09	CASE	Pharmacology	Which distinct soft tissue landmark is used to determine the height of injection for the IANB?		Pterygomandibular raphe	Coronoid notch	Intertragic notch	Parotid papilla	A	Why: The Pterygomandibular raphe is the visual soft tissue guide for the medial/lateral boundary. Why not: The Coronoid Notch is the hard tissue landmark for height, but the question asks for the soft tissue landmark.	Landmarks,Technique	
Q_46		RAPID_FIRE	Pharmacology	Lidocaine is metabolized primarily in the blood plasma by pseudocholinesterase.		TRUE	FALSE			B	Why: False. Lidocaine is an Amide and is metabolized in the LIVER. Esters are metabolized in the PLASMA. Why not: N/A	Metabolism,Amides	Metabolism,Amides
Q_47		RAPID_FIRE	Pharmacology	The maximum dose of Epinephrine for a cardiac patient is 0.04 mg.		TRUE	FALSE			A	Why: True. This equates to roughly 2 cartridges of 1:100,000 epinephrine (0.018mg per cart). Why not: N/A	Dosage,Epinephrine	Dosage,Epinephrine
Q_48		RAPID_FIRE	Pharmacology	Clindamycin is bacteriocidal.		TRUE	FALSE			B	Why: False. Clindamycin is bacteriostatic, meaning it inhibits protein synthesis rather than killing bacteria directly. Why not: N/A	Antibiotics,Mechanism	Antibiotics,Mechanism
Q_49		RAPID_FIRE	Pharmacology	The Gow-Gates technique aims to deposit anesthetic at the neck of the condyle.		TRUE	FALSE			A	Why: True. This is a higher block than the traditional IANB and targets the condylar neck to anesthetize the entire V3 division. Why not: N/A	Technique,Anesthesia	Technique,Anesthesia
Q_50		RAPID_FIRE	Pharmacology	Beta-blockers can increase the risk of hypertensive crisis if given with high doses of epinephrine.		TRUE	FALSE			A	Why: True. Non-selective beta-blockers prevent vasodilation (beta-2), leaving alpha-1 vasoconstriction unopposed, causing a spike in BP. Why not: N/A	Interactions,Epinephrine	Interactions,Epinephrine
Q_51		RAPID_FIRE	Pharmacology	Benzocaine is an amide local anesthetic.		TRUE	FALSE			B	Why: False. Benzocaine is an Ester (one "i" in the generic name). Why not: N/A	Classification,Esters	Classification,Esters
Q_52		RAPID_FIRE	Pharmacology	The long buccal nerve block is necessary for extraction of mandibular premolars.		TRUE	FALSE			B	Why: False. The Long Buccal nerve innervates the buccal soft tissue of the MOLARS only. Why not: N/A	Anatomy,Nerves	Anatomy,Nerves
Q_53		RAPID_FIRE	Pharmacology	Amoxicillin has a broader spectrum of activity than Penicillin VK.		TRUE	FALSE			A	Why: True. Amoxicillin (extended spectrum) covers more gram-negative bacteria compared to Penicillin VK. Why not: N/A	Antibiotics,Spectrum	Antibiotics,Spectrum
Q_54		RAPID_FIRE	Pharmacology	Methemoglobinemia is a potential side effect associated with Prilocaine.		TRUE	FALSE			A	Why: True. Prilocaine metabolites (o-toluidine) can oxidize hemoglobin to methemoglobin, reducing oxygen transport. Why not: N/A	Side Effects,Prilocaine	Side Effects,Prilocaine
Q_55		RAPID_FIRE	Pharmacology	In an infected area (low pH), the onset of local anesthesia is faster.		TRUE	FALSE			B	Why: False. Low pH creates more IONIZED molecules (cations) which cannot cross the nerve membrane, causing SLOWER onset and reduced efficacy. Why not: N/A	Mechanism,pH	Mechanism,pH
